{
  "needsHumanReview": true,
  "schemaVersion": 1,
  "unit": {
    "id": "unit-06-food",
    "order": 6,
    "titleUr": "کھانا اور پینا",
    "titleEn": "Food and drink",
    "descriptionUr": "کھانے، پینے، ناشتے اور کھانے کے آداب کے عام الفاظ سیکھیں۔",
    "descriptionEn": "Learn everyday food and drink words, meals and polite table phrases.",
    "icon": "restaurant-outline",
    "lessons": [
      { "id": "u06-l1-staples" },
      { "id": "u06-l2-foods" },
      { "id": "u06-l3-meals" },
      { "id": "u06-l4-table" }
    ],
    "unlock": { "requiresUnitId": "unit-05-numbers" }
  },
  "lessons": [
    {
      "id": "u06-l1-staples",
      "unitId": "unit-06-food",
      "order": 1,
      "titleUr": "بنیادی کھانے اور مشروبات",
      "titleEn": "Staple foods and drinks",
      "items": [
        { "id": "u06-gohan", "kind": "word" },
        { "id": "u06-pan", "kind": "word" },
        { "id": "u06-mizu", "kind": "word" },
        { "id": "u06-ocha", "kind": "word" },
        { "id": "u06-tabemasu", "kind": "word" },
        { "id": "u06-nomimasu", "kind": "word" },
        { "id": "u06-s1", "kind": "sentence" }
      ]
    },
    {
      "id": "u06-l2-foods",
      "unitId": "unit-06-food",
      "order": 2,
      "titleUr": "مزیدار کھانے",
      "titleEn": "Everyday foods",
      "items": [
        { "id": "u06-sakana", "kind": "word" },
        { "id": "u06-tamago", "kind": "word" },
        { "id": "u06-yasai", "kind": "word" },
        { "id": "u06-kudamono", "kind": "word" },
        { "id": "u06-ringo", "kind": "word" },
        { "id": "u06-oishii", "kind": "word" },
        { "id": "u06-s2", "kind": "sentence" }
      ]
    },
    {
      "id": "u06-l3-meals",
      "unitId": "unit-06-food",
      "order": 3,
      "titleUr": "دن کے کھانے",
      "titleEn": "Meals of the day",
      "items": [
        { "id": "u06-asagohan", "kind": "word" },
        { "id": "u06-hirugohan", "kind": "word" },
        { "id": "u06-bangohan", "kind": "word" },
        { "id": "u06-onaka-ga-sukimashita", "kind": "phrase" },
        { "id": "u06-nodo-ga-kawakimashita", "kind": "phrase" },
        { "id": "u06-itadakimasu", "kind": "phrase" },
        { "id": "u06-s3", "kind": "sentence" }
      ]
    },
    {
      "id": "u06-l4-table",
      "unitId": "unit-06-food",
      "order": 4,
      "titleUr": "میز کے آداب",
      "titleEn": "Table manners",
      "items": [
        { "id": "u06-gochisousama", "kind": "phrase" },
        { "id": "u06-omizu-o-kudasai", "kind": "phrase" },
        { "id": "u06-menyuu", "kind": "word" },
        { "id": "u06-s4", "kind": "sentence" },
        { "id": "u06-s5", "kind": "sentence" },
        { "id": "u06-s6", "kind": "sentence" },
        { "id": "u06-s7", "kind": "sentence" }
      ]
    }
  ],
  "vocabulary": [
    {
      "id": "u06-gohan",
      "kind": "word",
      "ja": "ご飯",
      "reading": "ごはん",
      "romaji": "gohan",
      "meaningUr": "چاول / کھانا",
      "meaningEn": "Rice; meal",
      "kanji": "飯",
      "pos": "noun",
      "tags": ["food", "meal", "noun"],
      "unitId": "unit-06-food",
      "lessonId": "u06-l1-staples",
      "needsHumanReview": true,
      "segments": [{ "text": "ご" }, { "text": "飯", "reading": "はん" }],
      "exampleIds": ["u06-s1"],
      "audioText": "ご飯",
      "level": "N5-ish"
    },
    {
      "id": "u06-pan",
      "kind": "word",
      "ja": "パン",
      "reading": "パン",
      "romaji": "pan",
      "meaningUr": "روٹی",
      "meaningEn": "Bread",
      "pos": "noun",
      "tags": ["food", "bread", "noun"],
      "unitId": "unit-06-food",
      "lessonId": "u06-l1-staples",
      "needsHumanReview": true,
      "exampleIds": ["u06-s4"],
      "audioText": "パン",
      "level": "N5-ish"
    },
    {
      "id": "u06-mizu",
      "kind": "word",
      "ja": "水",
      "reading": "みず",
      "romaji": "mizu",
      "meaningUr": "پانی",
      "meaningEn": "Water",
      "kanji": "水",
      "pos": "noun",
      "tags": ["drink", "water", "noun"],
      "unitId": "unit-06-food",
      "lessonId": "u06-l1-staples",
      "needsHumanReview": true,
      "segments": [{ "text": "水", "reading": "みず" }],
      "exampleIds": ["u06-s1"],
      "audioText": "水",
      "level": "N5-ish"
    },
    {
      "id": "u06-ocha",
      "kind": "word",
      "ja": "お茶",
      "reading": "おちゃ",
      "romaji": "ocha",
      "meaningUr": "چائے",
      "meaningEn": "Tea",
      "kanji": "茶",
      "pos": "noun",
      "tags": ["drink", "tea", "noun"],
      "unitId": "unit-06-food",
      "lessonId": "u06-l1-staples",
      "needsHumanReview": true,
      "segments": [{ "text": "お" }, { "text": "茶", "reading": "ちゃ" }],
      "exampleIds": ["u06-s3", "u06-s5"],
      "audioText": "お茶",
      "level": "N5-ish"
    },
    {
      "id": "u06-tabemasu",
      "kind": "word",
      "ja": "食べます",
      "reading": "たべます",
      "romaji": "tabemasu",
      "meaningUr": "کھانا",
      "meaningEn": "To eat (polite)",
      "kanji": "食",
      "pos": "verb",
      "tags": ["verb", "food", "polite"],
      "unitId": "unit-06-food",
      "lessonId": "u06-l1-staples",
      "needsHumanReview": true,
      "segments": [{ "text": "食", "reading": "た" }, { "text": "べます" }],
      "exampleIds": ["u06-s1"],
      "audioText": "食べます",
      "level": "N5-ish"
    },
    {
      "id": "u06-nomimasu",
      "kind": "word",
      "ja": "飲みます",
      "reading": "のみます",
      "romaji": "nomimasu",
      "meaningUr": "پینا",
      "meaningEn": "To drink (polite)",
      "kanji": "飲",
      "pos": "verb",
      "tags": ["verb", "drink", "polite"],
      "unitId": "unit-06-food",
      "lessonId": "u06-l1-staples",
      "needsHumanReview": true,
      "segments": [{ "text": "飲", "reading": "の" }, { "text": "みます" }],
      "exampleIds": ["u06-s1", "u06-s3", "u06-s5"],
      "audioText": "飲みます",
      "level": "N5-ish"
    },
    {
      "id": "u06-sakana",
      "kind": "word",
      "ja": "魚",
      "reading": "さかな",
      "romaji": "sakana",
      "meaningUr": "مچھلی",
      "meaningEn": "Fish",
      "kanji": "魚",
      "pos": "noun",
      "tags": ["food", "fish", "noun"],
      "unitId": "unit-06-food",
      "lessonId": "u06-l2-foods",
      "needsHumanReview": true,
      "segments": [{ "text": "魚", "reading": "さかな" }],
      "exampleIds": ["u06-s2", "u06-s7"],
      "audioText": "魚",
      "level": "N5-ish"
    },
    {
      "id": "u06-tamago",
      "kind": "word",
      "ja": "卵",
      "reading": "たまご",
      "romaji": "tamago",
      "meaningUr": "انڈا",
      "meaningEn": "Egg",
      "kanji": "卵",
      "pos": "noun",
      "tags": ["food", "egg", "noun"],
      "unitId": "unit-06-food",
      "lessonId": "u06-l2-foods",
      "needsHumanReview": true,
      "segments": [{ "text": "卵", "reading": "たまご" }],
      "exampleIds": ["u06-s2", "u06-s4"],
      "audioText": "卵",
      "level": "N5-ish"
    },
    {
      "id": "u06-yasai",
      "kind": "word",
      "ja": "野菜",
      "reading": "やさい",
      "romaji": "yasai",
      "meaningUr": "سبزیاں",
      "meaningEn": "Vegetables",
      "kanji": "野菜",
      "pos": "noun",
      "tags": ["food", "vegetable", "noun"],
      "unitId": "unit-06-food",
      "lessonId": "u06-l2-foods",
      "needsHumanReview": true,
      "segments": [{ "text": "野菜", "reading": "やさい" }],
      "exampleIds": ["u06-s7"],
      "audioText": "野菜",
      "level": "N5-ish"
    },
    {
      "id": "u06-kudamono",
      "kind": "word",
      "ja": "果物",
      "reading": "くだもの",
      "romaji": "kudamono",
      "meaningUr": "پھل",
      "meaningEn": "Fruit",
      "kanji": "果物",
      "pos": "noun",
      "tags": ["food", "fruit", "noun"],
      "unitId": "unit-06-food",
      "lessonId": "u06-l2-foods",
      "needsHumanReview": true,
      "segments": [{ "text": "果物", "reading": "くだもの" }],
      "exampleIds": [],
      "audioText": "果物",
      "level": "N5-ish"
    },
    {
      "id": "u06-ringo",
      "kind": "word",
      "ja": "りんご",
      "reading": "りんご",
      "romaji": "ringo",
      "meaningUr": "سیب",
      "meaningEn": "Apple",
      "pos": "noun",
      "tags": ["food", "fruit", "noun"],
      "unitId": "unit-06-food",
      "lessonId": "u06-l2-foods",
      "needsHumanReview": true,
      "exampleIds": [],
      "audioText": "りんご",
      "level": "N5-ish"
    },
    {
      "id": "u06-oishii",
      "kind": "word",
      "ja": "おいしい",
      "reading": "おいしい",
      "romaji": "oishii",
      "meaningUr": "مزیدار",
      "meaningEn": "Delicious",
      "pos": "i-adjective",
      "tags": ["adjective", "food", "taste"],
      "unitId": "unit-06-food",
      "lessonId": "u06-l2-foods",
      "needsHumanReview": true,
      "exampleIds": ["u06-s2"],
      "audioText": "おいしい",
      "level": "N5-ish"
    },
    {
      "id": "u06-asagohan",
      "kind": "word",
      "ja": "朝ご飯",
      "reading": "あさごはん",
      "romaji": "asagohan",
      "meaningUr": "ناشتہ",
      "meaningEn": "Breakfast",
      "kanji": "朝",
      "pos": "noun",
      "tags": ["food", "meal", "morning", "noun"],
      "unitId": "unit-06-food",
      "lessonId": "u06-l3-meals",
      "needsHumanReview": true,
      "segments": [
        { "text": "朝", "reading": "あさ" },
        { "text": "ご飯", "reading": "ごはん" }
      ],
      "exampleIds": ["u06-s4"],
      "audioText": "朝ご飯",
      "level": "N5-ish"
    },
    {
      "id": "u06-hirugohan",
      "kind": "word",
      "ja": "昼ご飯",
      "reading": "ひるごはん",
      "romaji": "hirugohan",
      "meaningUr": "دوپہر کا کھانا",
      "meaningEn": "Lunch",
      "kanji": "昼",
      "pos": "noun",
      "tags": ["food", "meal", "daytime", "noun"],
      "unitId": "unit-06-food",
      "lessonId": "u06-l3-meals",
      "needsHumanReview": true,
      "segments": [
        { "text": "昼", "reading": "ひる" },
        { "text": "ご飯", "reading": "ごはん" }
      ],
      "exampleIds": [],
      "audioText": "昼ご飯",
      "level": "N5-ish"
    },
    {
      "id": "u06-bangohan",
      "kind": "word",
      "ja": "晩ご飯",